,EventName,Date,City/Country,Exhibits,URL
94,"22nd China (Guangzhou) International Platemetal, Bar, Wire, Metal Processing Setting Equipment Exhibition","September 16, 2021 - September 18, 2021",Guangzhou China Asia,"Steel smelting skill and technology, aluminum, copper manufacturer, stainless steel manufacturer; Plate; Strip and steel band; Wire rod; Steel mesh; Board cutting equipment; Bar and wire rod mill; Machinery for metal processing, testing machine for metal materials; Cooling fluid and oil for metal processing; Set of welding apparatus; Metallurgic automation apparatus; etc.",https://www.jetro.go.jp/en/database/j-messe/tradefair/detail/119088
95,World Seafood Shanghai 2021 Shanghai International Fisheries and Seafood Exhibition,"August 25, 2021 - August 27, 2021",Shanghai China Asia,"Aquatic products,seafood,processed aquatic products,prepared foods, seasoned seafood,processing and packaging equipment cold chain storage and transportation,aquaculture technology and equipment, aquatic feed and drug,pelagic fishery, marine fishing",https://www.jetro.go.jp/en/database/j-messe/tradefair/detail/110315
96,WMF 2021 Shanghai International Furniture Machinery Woodworking Machinery Fair,"September  3, 2021 - September  6, 2021",Shanghai China Asia,"Tools and Machinery for Custom and Mass Production, Machine Components and Automation Technology, Surface Technology, Wood Based Panel Production, Wood Primary Processing, Sawmill Technology, Energy from Wood, Wooden Architecture Technology, Forestry Technology, Green Production & Safety Control, Wood Products Packaging, Raw materials & Accessories for wood production, Knives, Blades, Machinery Accessories and Hand Tools, Engraving Machinery, Upholstery Machinery",https://www.jetro.go.jp/en/database/j-messe/tradefair/detail/114220
97,STX2021 The 20th International Exhibition on Textile Industry,"November 23, 2021 - November 26, 2021",Shanghai China Asia,"Bleaching, Dyeing, Printing, Finishing and Making- up Machinery-Digital Printing Machinery-Fiber Manufacturing Machinery-Knitting & Hosiery Machinery-Machinery and Accessories for Apparel-Mill Management Instruments-New Materials, Technology & Designs for Knitting Products-Non-Woven Fabric Machinery and Tufting Machinery-Software and IT for Textile and Garment Industry (CAD/CAM/CIM)-Spare Parts and Accessories for Textile and Garment Machinery-Spinning Machinery-Techtextile Technology & Product-Testing and Measuring Equipment-Textile Chemicals-Warp-Knitting, Embroidery and Weaving Machinery-Yarn Twisters, Winders and Accessories",https://www.jetro.go.jp/en/database/j-messe/tradefair/detail/114219
98,CAHE2021 19th China Animal Husbandry Expo,"May 18, 2021 - May 20, 2021",Changsha China Asia,"animal breeding, animal health, animal housing, feed and feed additives, feed processing, grain & raw material, processing equipment, meat processing, packaging, refrigeration, meat products, egg products, grass and seed, media, knowledge transfer, consultancy, bio-energy and etc.",https://www.jetro.go.jp/en/database/j-messe/tradefair/detail/112917
99,SIAL China 2021,"May 18, 2021 - May 20, 2021",Shanghai China Asia,"Wine&spirits, Non-alcoholic drinks, Alcoholic beverages, Preserved&canned foods, Confectionery, Delicatessen, Meat&offals, Fish and shellfish, Dairy products&eggs, Horticulture, Fruits&vegetables, Dried fruits, Frozen products, Health food&diet products, Halal Food, Food Equipment/Technologies/Services, etc.",https://www.jetro.go.jp/en/database/j-messe/tradefair/detail/110637
100,FHC CHINA 2021 Food Hospitality China,"November  9, 2021 - November 11, 2021",Shanghai China Asia,"Snacks & Confectionery, Meat, Dairy, Fresh Produce, Seafood, Bakery & Pastry, Chocolate China, Ice Cream China, Special Tea & Coffee, Beer China, Edible Oil China, Drinks, Foodservice Equipment, Cold Chain & Logistic, Foodservice & Technology, Restaurant Design & Deco",https://www.jetro.go.jp/en/database/j-messe/tradefair/detail/110664
101,Eco Expo Asia International Trade Fair on Environmental Protection,"October 27, 2021 - October 30, 2021",Hong Kong China Asia,"Air Quality, Eco-friendly Products, Green Building and Energy Efficiency, Green Transportation, Waste Management and Recycling, Water Treatment and Quality Management, Testing, Analysis and Certification, Environmental Protection Services and Research, and more.",https://www.jetro.go.jp/en/database/j-messe/tradefair/detail/110641
102,MEGA SHOW Series Part 2,"October 27, 2021 - October 29, 2021",Hong Kong China Asia,"Gifts, Giftwrap & Packaging, Travel goods, Luggage, Stationery, Sanitary/Bathroom accessories, and more.",https://www.jetro.go.jp/en/database/j-messe/tradefair/detail/110652
103,MEGA SHOW Series Part 1,"October 20, 2021 - October 23, 2021",Hong Kong China Asia,"gifts, premiums, housewares, kitchen & dining, lifestyle products, toys & games and stationery, christmas & seasonal products, sporting goods, and more.",https://www.jetro.go.jp/en/database/j-messe/tradefair/detail/110651
104,Interior Lifestyle China 2021,"September  9, 2021 - September 11, 2021",Shanghai China Asia,"cookware, tableware, kitchen accessories, houseware, storage, small electrical appliances, interior decoration, design accessories, small furniture, lighting, home accessories, home textiles, home fragrances,  design and trend oriented gifts, arts and crafts, beauty and wellness products, gadgets, personal and fashion accessories, travel accessories",https://www.jetro.go.jp/en/database/j-messe/tradefair/detail/110627
105,SPINEXPO 2021 (37th) The primary exhibition for yarns knitwear,"August 31, 2021 - September  2, 2021",Shanghai China Asia,"textile, fibres & yarns, knitwear, knitted fabrics, knitwear machinery, style offices.",https://www.jetro.go.jp/en/database/j-messe/tradefair/detail/110614
106,ZhejiangTex 2021 21st Zhejiang International Trade Fair For Textile And Garment Industry,"June  8, 2021 - June 10, 2021","Yiwu City, Zhejiang Province China Asia","Seamless Underwear Machinery,  Knitting and Hosiery Machinery, Flat and Warp Knitting Machinery, Knitting and Weaving Finishers, Packaging Machinery, Machinery for Winding, Texturing and Twisting, Cutting Machinery, Laser Processing Machinery and CAD/CAM System, Sewing Machines and Accessories, Embroidery and Quilting Machinery, Post-sewing, Conveying and Ironing Equipment, Braiding and Zipper-making Machinery, Logo Printing Machinery, Digital Printing Machine, Thermal / Cold Transfer Printing Machine, Flat / Rotary Screen Printing Machine, Automatic Platform Printing Machine, Ink and Materials, Related Printing Software, Design and Products, Yarn and Knitting Raw Materials, Underwear, Bra, Swimwear, Beachwear, Sportswear and Loungewear, Hosiery, Gloves, Scarves and Hats, Curtains, Cloth Crafts and Knitted Home Textiles, Laces, Ribbons and Embroidery, Accessories such as Zippers, Straps, Labels, Buttons and Clothes Hangers etc.",https://www.jetro.go.jp/en/database/j-messe/tradefair/detail/108347
107,CBME China 2021 Children Baby Maternity Expo,"July 14, 2021 - July 16, 2021",Shanghai China Asia,"Maternity&Baby Care Products/Baby Carriages, Car Seats&Furniture/Food, Healthcare Products&Snacks/Toys, Educational Products/Child, Baby&Teenager Clothing, Footwear&accesories/Maternity Clothing, Underwear&Accessories, Outdoor Recreation & Sports, Natural Products, and more.",https://www.jetro.go.jp/en/database/j-messe/tradefair/detail/110628
108,CIMT2021 17th China International Machine Tool Show,"April 12, 2021 - April 17, 2021",Beijing China Asia,"Metal Cutting Machine, Metal Forming Machine, EDM, Laser Processing and Other Non -Traditional Machine Tools, Inspection & Measuring Equipment, CNC System, Industrial Robot, Logistics Distribution System, Wood Working Machine, and more.",https://www.jetro.go.jp/en/database/j-messe/tradefair/detail/110408
109,DOMOTEX asia CHINAFLOOR 2021,"March 24, 2021 - March 26, 2021",Shanghai China Asia,"Carpets/Rugs(Hand-Made), Woven Carpets(Machine-Made), Textile Floor Coverings, Wall-to-Wall, Parquet Floors, Contract Flooring, Fibres, Yarns and Textiles, Applications and Installation Technology, Presentation of Goods, Publications, Design.",https://www.jetro.go.jp/en/database/j-messe/tradefair/detail/110625
110,GITF Guangzhou International Travel Fair 2021,"June 10, 2021 - June 12, 2021",Guangzhou China Asia,"Tourism Board & Bureau / Tourism Alliance / Tourism Association, Travel Agency / Travel Operator, Scenic Spot / Theme Park, Airlines / Airline Alliance / Airline Agency, Themed Tour / Tailor Made Travel, Golf Course / Golf Club, IT Service for Travel Industry, Tourism Real Estate, B & B / Resort / Hotel / Hotel Group, Online Reservation Service, Cruise / Yacht & Yacht Club, M.I.C.E. / Event & Conference Management, City Planning / Landscape Design, Car Rental / RV - Recreational Venhicle / Self-drive Club, Financial Product for Tourism, Tourist Commodity, Museum / Art Museum / Science Museum, Cultural Tourism Projects, Other Relevant Sectors",https://www.jetro.go.jp/en/database/j-messe/tradefair/detail/110093
111,Shanghai World of Packaging (swop),"November 23, 2021 - November 25, 2021",Shanghai China Asia,"Food, Beverage, Sweets, Bakery, Pharma, Cosmetics, Non-food, Industry, Package Plastic, Print, E-Commerce",https://www.jetro.go.jp/en/database/j-messe/tradefair/detail/110647
112,Steel Build 2021 10th China (Guangzhou) International Exhibition for Steel Construction Metal Building Materials,"May 10, 2021 - May 12, 2021",Guangzhou China Asia,"Steel Structures, Iron and Steel products, Steel Structural Plates, Joint Products and Equipment of Steel Structure, Protection Systems for Building Steel Structures, Technologies and Supporting Decoration Products of New-type Houses, Aluminum Alloy, Plastic-steel, Non-metallic Decorative Materials, Related Technologies and Equipment, Three-dimensional Garages, Steel-structure Doors, Processing Equipment and Testing Equipment of Metal Structures, Design, Analysis and Calculation Software, CAD Drawing Software, Design and Construction Project Display",https://www.jetro.go.jp/en/database/j-messe/tradefair/detail/110560
113,"Roof China 2021 11th China (Guangzhou) International Roof, Facade Waterproofing Exhibition","May 10, 2021 - May 12, 2021",Guangzhou China Asia,"Asphalt-based waterproof sheets, Single-layer roofing systems, polymer sheets, Polyurea coatings, Waterproof coatings , Rigid waterproofing and lost circulation materials, Planting roofing system engineering, Thermal insulation and energy-saving materials, Raw and auxiliary Materials, Tool equipment and services, Materials for wall, Energy-saving roofing systems and relative technologies, Related parts and accessories, Waterproof cushion for slope roof, Related manufacturing equipment and technologies, Sealing materials, Metal roofing systems, Solar PV materials and BIPV power systems, Related detecting instruments, Related construction equipment and application technologies, Various Tiles, Waterproof materials for infrastructure and municipal engineering, Waterproof engineering system accessories and auxiliary materials. Scientific research achievements, management software and professional books",https://www.jetro.go.jp/en/database/j-messe/tradefair/detail/110559
114,"PMMHF 2021 11th China Int'l Prefab House, Modular Building Mobile House Space Fair","May 10, 2021 - May 12, 2021",Guangzhou China Asia,"House Design and Construction, By structure: color steel house in different structures, modular house, portable shipment container, steel structure house, wooden house, sunhouse, etc, By purpose: prefab villa, office, plant, warehouse, garbage house, greenhouse, pavilion, restaurants, kiosks, pet house, portable restroom, etc, House Construction Material and Accessories: Color steel panel, heat insulation panel, sandwich panel, exterior panel, precast panel, roof sheet, lighting, ventilation facilities, portable door and window, structural steel, steel frame, hardware accessories, and other off-site construction technologies and design, etc, Modular house and bathroom modular, kitchen modular, etc.",https://www.jetro.go.jp/en/database/j-messe/tradefair/detail/110558
115,LET a CeMAT ASIA 2021 China International Logistics Equipment Technology Exhibition (Guangzhou),"May 25, 2021 - May 27, 2021",Guangzhou China Asia,"Logistics System integration and Solutions, Informatization of Logistics and IOT, Warehouse Technology and Workshop Equipment, Mechanical Handling, Logistics Robotics, AGV and Accessories, Conveying and Sorting Equipment, Packaging Equipment, Packing Products and Materials, Cold chain logistics and Vehicles, Lifting equipment and Accessories, Logistics Peripheral Equipment, Logistics Service and Supply Chain Management",https://www.jetro.go.jp/en/database/j-messe/tradefair/detail/110557
116,"ISH China CIHE China International Trade Fair for Heating, Ventilation, Air Conditioning, Sanitation Home Comfort Systems","May 12, 2021 - May 14, 2021",Beijing China Asia,"HVAC product & technology: Boiler, Radiator, Floor heating, and more. Intelligent Control:Sensor, thermostat, actuator, wireless control system, heating control system, and more. Home confort: fresh air system, water purification, air purification and more. Plumbing-Building water supply & drainage: Valve & actuator, Building fire-fighting equipment, and more.",https://www.jetro.go.jp/en/database/j-messe/tradefair/detail/110555
117,Automotive World China 2021,"August 25, 2021 - August 27, 2021",Shenzhen China Asia,"automotive OEM,automotive electronics industry",https://www.jetro.go.jp/en/database/j-messe/tradefair/detail/110541
118,NEPCON ASIA 2021,"August 25, 2021 - August 27, 2021",Shenzhen China Asia,"Electronics manufacturing & mounting equipment, soldering related, factory equipment & equipment, measuring & testing & analysis equipment, visual inspection equipment, inspection related parts, assembly equipment, packaging materials & parts, electronic manufacturing automation related equipment & parts, etc.",https://www.jetro.go.jp/en/database/j-messe/tradefair/detail/110540
119,ICMD Spring 2021 International Component Manufacturing Desgign Show,"May 13, 2021 - May 16, 2021",Shanghai China Asia,"Materials, Design, R&D, Components, Parts, Modules, Software, Data Processing, Manufacturing Equipment, OEM technology, Packaging, Printing, Cleaning, Disinfecting and other relative services.",https://www.jetro.go.jp/en/database/j-messe/tradefair/detail/110539
120,CMEF Spring 2021 China International Medical Equipment Fair,"May 13, 2021 - May 16, 2021",Shanghai China Asia,"Medical optical and electromedical devices, smart healthcare and wearable devices, medical imaging, medical testing, in-vitro diagnostics, hospital construction and other services, artificial intelligence (AI), computed tomography (CT), magnetic resonance imaging (MRI), operating rooms, molecular diagnostics, point-of-care testing (POCT), Rehabilitation Project, Rehabilitation Assistive Devices, Ambulance Equipment",https://www.jetro.go.jp/en/database/j-messe/tradefair/detail/110538
121,Marintec China 2021,"December  7, 2021 - December 10, 2021",Shanghai China Asia,"Association and Government Bodies, Classification Society, Paint and coating, communications Equipment, Computer Systems and software, Fire Protection and safety equipment, Navigation, Publication, Ship Design and Architect, Ship Engineering, Ship Registry and Marine Inspection, Ship Building,etc.",https://www.jetro.go.jp/en/database/j-messe/tradefair/detail/110489
122,Bakery China 2021,"April 27, 2021 - April 30, 2021",Shanghai China Asia,"Baking ingredients, Baking equipment/processing, Baking packaging solutions, Other assisting contents in baking industry; Laboratory and measuring instruments, Display, storage and refrigerated cabinets, Gastronomy and catering, OEM / ODM, Services.",https://www.jetro.go.jp/en/database/j-messe/tradefair/detail/110447
123,2021 International Rehabilitation Personal Health Show,"May 13, 2021 - May 16, 2021",Shanghai China Asia,The ranges of exhibits:1.Rehabilitation2.Assistive devices3.Personal Care 4.Home health care5.Elderly care & Smart medical wearables devices6.Chinese traditional medicine7.Massage products8.Nutrition Food and anti-age food,https://www.jetro.go.jp/en/database/j-messe/tradefair/detail/110517
124,HKISF2022 Hong Kong International Stationery Fair (21st ),"January 10, 2022 - January 13, 2022",Hong Kong China Asia,"Artist supplies/ Children's stationery & school supplies/ Computer peripherals & related accessories/ Consumbale for office equipment/ Gift stationery/ Office equipment/ Paper & printing products/ Writing equipment, etc.",https://www.jetro.go.jp/en/database/j-messe/tradefair/detail/108579
125,ITES2021 Shenzhen International Industrial Manufacturing Technology and Equipment Exhibition,"March 30, 2021 - April  2, 2021",Shenzhen China Asia,"Metal Cutting Machine Tool, Metal Forming Machine Tool, Additive Manufacturing, Tools & Industrial Consumable, Industrial Measurement, Industrial Supply, Robotics & Smart Factory, Industrial Service",https://www.jetro.go.jp/en/database/j-messe/tradefair/detail/110204
126,CDS 2021 China Dental Show,"October  9, 2021 - October 12, 2021",Shanghai China Asia,"Dental/oral medicine equipments and instruments, oral medicine;<br/>Oral imaging instrument, surgery equipment;<br/>Oral medicine/surgery/prosthodontic consumables;",https://www.jetro.go.jp/en/database/j-messe/tradefair/detail/110501
127,IESD China 2021 International Exhibition on Surfactant Detergent,"May 13, 2021 - May 15, 2021",Shanghai China Asia,"Ionic surfactants, non-ionic surfactants, zwitterionic surfactants, new, green surfactants, corporate image of ethylene oxide and its derivatives, alkylbenzene (AB), ethylene oxide (EO) , Propylene oxide (PO), nonylphenol (NP), octylphenol (OP), ethylene glycol (EG), ethanolamine, polyethylene, glycol(PEG), ethyleneamine(EA), fatty acids, fatty alcohols, fatty amines, fatty acid methyl esters, detergents, personal and home care products, analytical testing equipment, quality control, packaging technology for daily chemical products, materials and machinery, other surfactants, Detergent and various surfactants, detergent research results, patented technology",https://www.jetro.go.jp/en/database/j-messe/tradefair/detail/110469
128,China International Big Data Industry Expo 2021,"May 26, 2021 - May 29, 2021",Guiyang China Asia,"black technology, advanced and innovative products, technological achievements and business model in the field of big data",https://www.jetro.go.jp/en/database/j-messe/tradefair/detail/110468
129,BJKSE 23rd Beijing International Kindergarten Supplies Exhibition,"May 12, 2021 - May 14, 2021",Beijing China Asia,"Toy: Plastic toys, Electric Toys, Wooden Toys, Plush Toys, etc. Kid-Education: Preschool tool, Entertainment facilities, Education software, Kid-Goods: Stationery & Child-Commodity, Cartoons Video Game: Cartoon toys& Cartoon video",https://www.jetro.go.jp/en/database/j-messe/tradefair/detail/110466
130,APFE2021 17th Shanghai International Adhesive Tape Functional Film Optical Film Expo,"May 26, 2021 - May 28, 2021",Shanghai China Asia,"Adhesive tape, Protective film, Functional film, Release film, Release liner, PSA, Resin & other chemical products,Manufacturing equipment and instruments, Materials and chemical products, and more.",https://www.jetro.go.jp/en/database/j-messe/tradefair/detail/110465
131,AAA 2021 Asia Amusement Attractions Expo,"May 10, 2021 - May 12, 2021",Guangzhou China Asia,"park scenic areas and playground facilities, park planning and design and operators, cultural tourism, video game products and accessories, mobile games and related technical equipment, home game consoles and peripherals, online games, Various products and services in the game-related entertainment and entertainment park related industries such as entertainment-type machines, games and tourism-related media, publications, games & playground software development, game talent training institutions, and other attractions",https://www.jetro.go.jp/en/database/j-messe/tradefair/detail/110463
132,14th China International Exhibition on Nuclear Power Industry 2021,"April 14, 2021 - April 16, 2021",Beijing China Asia,"Reactor & reactor coolant system, Core & fuel, Reactor internals, Reactor pressure vessel, Control rod drive mechanism (CRDM), Steam generator (SG), Reactor coolant pump, Containment vessel, ECCS, Turbine-generator, Blades, Instrumentation & control, Electrical system, Various pipes, pumps & valves, Computer aided design in nuclear power station & computerized documentation management, Welding, machining, heat treatment & assembly technology, Engineering machinery & special tools, Decommissioning of NPPs, Operation & maintenance devices, Nuclear accident emergency communication devices, Nuclear safety & certification, The standardization plan of nuclear equipment, URD, EURD & series development of NPP, Nuclear safety & protection equipment & materials, Recycling used nuclear fuel, Waste disposal, Transportation & logistics, Investment & finance of nuclear power projects, Popularization of nuclear power technology",https://www.jetro.go.jp/en/database/j-messe/tradefair/detail/110382
133,NEPCON China 2021,"April 21, 2021 - April 23, 2021",Shanghai China Asia,"Board handler conveyor systems & accessories, Chip carriers, Component feeding systems, Curing systems, De-soldering systems, Encapsulation equipments, Ovens & furnaces, PCB assembly, PCB fabrication, Pick & place systems, Screen printers & accessories, Vision placement machines.",https://www.jetro.go.jp/en/database/j-messe/tradefair/detail/110387
134,"IT CM China Incentive Travel Conventions, Meetings China","March 23, 2021 - March 25, 2021",Shanghai China Asia,"Adventure & Incentive Travel, Airlines, Airports, Coach, Car and Railway Operators, Convention & Exhibition Venues, Credit/Charge Card Companies, Cruise Lines, Destination Management, Event Management, Entertainment, Global Distribution Systems, Golf Courses, Hotels & Resorts, Spas, etc.",https://www.jetro.go.jp/en/database/j-messe/tradefair/detail/110269
135,G2E Asia Global Gaming Expo Asia 2021,"May 25, 2021 - May 27, 2021",Macau China Asia,"Gaming-entertainment, equipment and services.",https://www.jetro.go.jp/en/database/j-messe/tradefair/detail/108600
136,CIFM interzum guangzhou 2021,"March 28, 2021 - March 31, 2021",Guangzhou China Asia,"Function and Components,Materials and Components for Interior Works,Machinery and Equipment for Upholstery and Bedding, Materials and Accessories for Upholstery and Bedding,Wood Product, Panel and Laminate,Adhesive, Paint and Other Chemical Materials,Machines and Auxiliary Machines for Woodworking Furniture Production, Organization,Service and Media",https://www.jetro.go.jp/en/database/j-messe/tradefair/detail/110267
137,AMR 2021 AUTO MAINTENANCE REPAIR EXPO,"April 24, 2021 - April 27, 2021",Beijing China Asia,"Painting, Car Care & Car Wash, Engine Care, Lubricant & Spare Parts,Spare Parts,Workshop Equipment,Tools & Diagnostics,Tools, Workshop Equipment & Tyre Repair,Tools, Collision Repair & Testing Equipment",https://www.jetro.go.jp/en/database/j-messe/tradefair/detail/110232
138,GETshow 2021 Guangzhou Entertainment Technology Show,"May  8, 2021 - May 11, 2021",Guangzhou China Asia,"Stage performance audio, Card package audio, Public broadcast, conference system, stage lighting, LED, laser equipment, microphone, power amplifier, stage equipment, intelligent lighting control system, etc",https://www.jetro.go.jp/en/database/j-messe/tradefair/detail/110085
139,ALUMINIUM CHINA 2021,"July  7, 2021 - July  9, 2021",Shanghai China Asia,"Aluminum raw material, aluminum semi-finished product / finished product, aluminum product, machinery / plant / equipment, surface treatment, light metal trade / service / consultant",https://www.jetro.go.jp/en/database/j-messe/tradefair/detail/110220
140,PCHi 2021 Personal Care and Homecare Ingredients,"March 24, 2021 - March 26, 2021",Shenzhen China Asia,"Suppliers and manufacturers of raw materials and ingredients for cosmetics, toiletries, personal care and home care products; including hair care, skin care, oral care, coloring, fragrance, natural ingredients, preservatives, detergents, pesticides, cleaning liquids, and many more",https://www.jetro.go.jp/en/database/j-messe/tradefair/detail/110102
141,AEE AEC 2021 Aerospace Engineering Exhibition,"August  6, 2021 - August  8, 2021",Shanghai China Asia,"Design, Engineering, Testing, Simulation, Materials, Manufacturing, 3D printing, Tools, Assembly, Industry 4.0, Digitalization, Components, Systems, Lifecycle Support, MRO",https://www.jetro.go.jp/en/database/j-messe/tradefair/detail/110089
142,GETshow 2021 Guangzhou Entertainment Technology Show,"May  8, 2021 - May 11, 2021",Guangzhou China Asia,"Stage performance audio, Card package audio, Public broadcast, conference system, stage lighting, LED, laser equipment, microphone, power amplifier, stage equipment, intelligent lighting control system, etc",https://www.jetro.go.jp/en/database/j-messe/tradefair/detail/110119
143,Prolight Sound Guangzhou 2021,"May 16, 2021 - May 19, 2021",Guangzhou China Asia,"Professional Audio, Professional Lighting, Stage Equipment, AV and Communication Equipment, Parts and Accessories, Projection and Display, Recording and Production, IT & Integration Technology, Others, Services",https://www.jetro.go.jp/en/database/j-messe/tradefair/detail/110092
