,EventName,Date,City/Country,Exhibits,URL
0,CDDS 2021 Chengdu International Cross Border e commerce Fair,"July 16, 2021 - July 18, 2021",Chengdu China Asia,"Snack food, beverages, dairy products, nutrition and health products, organic food, wine, agricultural products, etc., maternal and child toys, beauty and personal care, household products, crafts, gifts, clothing, etc., consumer electronics, 3C, smart wear, new materials , Biomedicine, 3C digital (cameras, mobile phones, computers and other accessories), smart products, household appliances, office equipment and consumables, kitchen supplies, home textiles, furniture, daily life, home decoration, pet supplies, etc., outdoor clothing, Outdoor equipment, sports and fitness products, auto accessories, etc., cosmetics, skin care, hair care, hair products, beauty tools, daily cleaning, health products, medical equipment, adult products, shoes, apparel, shoes, leather goods, luggage, toys, Baby diapers, feeding and washing, baby clothing, mother products, baby carriages,  platforms, service providers, logistics, financial payments, new retail, e-commerce,  etc.",https://www.jetro.go.jp/en/database/j-messe/tradefair/detail/119891
1,GOVirtual Business Expo Conference (GOVirtual Expo),"June 10, 2021 - June 12, 2021",Hong Kong China Asia,"Disruptive Business Innovations, Commerce Marketing Technology, Digital Sales Management, Payment & FinTech, Supply Chain & Logistics",https://www.jetro.go.jp/en/database/j-messe/tradefair/detail/119864
2,ProWine Asia international trade fair for wines and spirits,"September  7, 2021 - September  9, 2021",Hong Kong China Asia,"Bakery, Beer, Catering/Hospitality Technology, Food & Drinks, Foodservice Equipment, Hospitality Design & Supplies, Industry Services, internet Retail, Meat, Retail Design & In-Store Marketing, Retail Technology, Safety Security, Wine / Spirits",https://www.jetro.go.jp/en/database/j-messe/tradefair/detail/107977
3,HOFEX 2021 Asia's Leading Food Hospitality Tradeshow,"September  7, 2021 - September  9, 2021",Hong Kong China Asia,"Food & Drinks, Wines/Spirits/Beer, Coffee & Tea, Hospitality/Retail, Catering & Foodservice, Equipments, Bakery Equipment & Ingredients, Hospitality Interiors & Supplies.",https://www.jetro.go.jp/en/database/j-messe/tradefair/detail/106814
4,Paperworld China 2021 China International Stationery Office Supplies Exhibition,"October 15, 2021 - October 17, 2021",Shanghai China Asia,"Office supplies, Paper and printing products, Writing instruments, School supplies, IT and multimedia accessories, Art supplies, Gift articles and Hobby & crafts.",https://www.jetro.go.jp/en/database/j-messe/tradefair/detail/119777
5,wire China 2022 All China International Wire Cable Industry Trade Fair,"September 26, 2022 - September 29, 2022",Shanghai China Asia,"Wire manufacturing & finishing machinery, Cable and stranding machines, Fastener & spring manufacturing and finishing machinery, Process technology materials, Auxiliary process technology materials,  Materials, special wires & cables, Measuring & control technology.",https://www.jetro.go.jp/en/database/j-messe/tradefair/detail/110360
6,The 13th Shanghai International Petrochemical Technology and Equipment Exhibition,"August 25, 2021 - August 27, 2021",Shanghai China Asia,"Petrochemical Plant and Equipment; Refining Technology and Equipment; DCS, PLC Control System; Petrochemical Process and Technology; Petrochemical Products and Advanced Materials; Petrochemical Research and Laboratory Equipment; Equipment Overhaul, Maintenance and Management; Fluid Machinery;Solid Waste Disposal;Explosion-Proof Electric;Fire Safety and Emergency Equipment; Chemical Equipment & Technology",https://www.jetro.go.jp/en/database/j-messe/tradefair/detail/119706
7,cippe2021 21st China International Petroleum Petrochemical Technology and Equipment Exhibition,"June  8, 2021 - June 10, 2021",Beijing China Asia,"equipment and technology of onshore and offshore oil & gas, petrochemical, shale gas, offshore engineering, pipeline, explosion-proof instruments, soil remediation of oilfield, smart oilfield and communication, pump & valve......",https://www.jetro.go.jp/en/database/j-messe/tradefair/detail/110545
8,The 34th International Electric Vehicles Symposium Exhibition(EVS34),"June 25, 2021 - June 28, 2021",Nanjing China Asia,New energy vehicles Energy and infrastructure Batteries Powertrain,https://www.jetro.go.jp/en/database/j-messe/tradefair/detail/119688
9,World Intelligent Connected Vehicles Conference,"September 25, 2021 - September 28, 2021",Beijing China Asia,"Energy-efficient cars, new energy vehicles, batteries, electric motors, electric control and charging infrastructure.",https://www.jetro.go.jp/en/database/j-messe/tradefair/detail/119685
10,CBE CHINA BEAUTY EXPO 2021,"May 12, 2021 - May 14, 2021",Shanghai China Asia,"* Skin Care, Makeup and Color Cosmetics, Fragrance, Makeup Accessories, Personal Care, Household Detergent, Nature and Health Beauty Products, Franchises and Retail Stores, Importers, Agents and Distributors.* Beauty Salon & Spa Products and Equipments, Professional Makeup, Nail Care and Tattoo, Hair Products and Equipments, Professional Beauty Accessories, Beauty Schools, Institutions and Other Service Providers.* OEM/ODM, Private Label, Raw Materials and Ingredients, Packaging, Pumps/Valves/Sprayers/Caps and Accessories, Color Cosmetics Packaging, Tubes, Printing, Paper/Boxes/Bags and Machinery",https://www.jetro.go.jp/en/database/j-messe/tradefair/detail/110467
11,SHOES LEATHER GUANGZHOU 2021 The 30th International Exhibition on Shoes Leather Industry Guangzhou,"May 31, 2021 - June  3, 2021",Guangzhou China Asia,"Shoes Making Machinery / Equipment, Leather goods Making Machinery / Equipment, Tanning Machinery / Equipment, Sewing Machinery / Equipment, Leather / Tannery Raw Hides Synthetic Leather, Garment Leather, Furniture Leather, Shoes Materials Accessories / Components, Chemicals Technologies / Services, 3D Printing",https://www.jetro.go.jp/en/database/j-messe/tradefair/detail/119602
12,CIOE 2021 China International Optoelectronic Exposition,"September  1, 2021 - September  3, 2021",Shenzhen China Asia,"Optical Communications, Precision Optics, Lasers, Infrared Applications, Emerging Applications",https://www.jetro.go.jp/en/database/j-messe/tradefair/detail/119661
13,86th API China (Spring Show),"May 26, 2021 - May 28, 2021",Guangzhou China Asia,"API(active pharmaceutical ingredients), Intermediates, Fine Chemicals, Natural Extracts, CRO/CMO/CDMO, Animal Health-care feed, Chemical Reagent; Pharmaceutical Excipents; Pharmaceutical Packaging, Medicinal Plastic, Pharmaceutical Glass, Aluminum Foil, Caps & Butyl Stoppers, Capsule & Gelatin, Tube, Drug Delivery System; Pharmaceutical Machinery, Preparation equipment, Pharmaceutical Water Equipment, Autmation Equipment, Laboratory Equipment, EP& Clean Technology, Fluid Equipment, API Manufacture Equipment, Packaging Machinery, etc.",https://www.jetro.go.jp/en/database/j-messe/tradefair/detail/119655
14,Interwine China 2021 International Wine Spirits Exhibition,"October 28, 2021 - October 30, 2021",Shenzhen China Asia,"Sake, Still and/or sparkling wine, Spirits, Beer, Wine Accessories, Industry associated with the wine and spirits",https://www.jetro.go.jp/en/database/j-messe/tradefair/detail/119632
15,Interwine China 2021 International Wine Spirits Exhibition,"June  3, 2021 - June  5, 2021",Guangzhou China Asia,"Sake, Still and/or sparkling wine, Spirits, Beer, Wine Accessories, Industry associated with the wine and spirits",https://www.jetro.go.jp/en/database/j-messe/tradefair/detail/119631
16,Kitchen Bath China 2021,"May 26, 2021 - May 29, 2021",Shanghai China Asia,"Furniture and furnishing systems for kitchen & bath, Kitchen & washroom faucet, sanitaryware, shower box, unit bathroom, Building & construction material, green building material, building hardware, installation & tools, Heating engineering, Ventilation system, Solar heating system, etc.",https://www.jetro.go.jp/en/database/j-messe/tradefair/detail/109185
17,FENESTRATION BAU CHINA 2021,"November  2, 2021 - November  5, 2021",Shanghai China Asia,"Window and door systems, Curtain wall systems, Roof and ceiling construction, Building automation, Hardware fittings, Prefabrication materials, Energy-efficient and smart solutions, Building chemistry, Construction tools, Floor coverings, Thermal insulation, Building technology, IT integration in buildings, Lighting engineering",https://www.jetro.go.jp/en/database/j-messe/tradefair/detail/119609
18,"bauma China 2022 International Trade Fair for Construction Machinery, Building Material Machines, Mining Machines and Construction Vehicles","November 22, 2022 - November 25, 2022",Shanghai China Asia,"Construction vehicles, Earth-moving machines, Road Construction and Maintenance, Pipe & Cable Laying Equipment & Tools, Lifting appliances and conveyors, Construction equipment, tools and special systems, Handling and processing concrete and mortar at construction sites, Formwork and scaffoldings",https://www.jetro.go.jp/en/database/j-messe/tradefair/detail/119591
19,"analytica China 2022 International Trade Fair for Laboratory Technology, Analysis, Biotechnology and Diagnostics","November 14, 2022 - November 16, 2022",Shanghai China Asia,"Life sciences, biotechnology and diagnostics, Measuring and testing / Quality control, Laboratory equipment and technology analysis, Analysis, Environmental Monitoring equipment and technology,Food safety equipment and technology",https://www.jetro.go.jp/en/database/j-messe/tradefair/detail/119589
20,CIIE 2021 The 4th China International Import Expo,"November  5, 2021 - November 10, 2021",Shanghai China Asia,"Technical equipment, Automobile, Trade in services, Lifestyles, Medical Equipment & Health Care Products, Food & Agricultural Products",https://www.jetro.go.jp/en/database/j-messe/tradefair/detail/119261
21,ITE Hong Kong 2021,"June 17, 2021 - June 20, 2021",Hong Kong China Asia,"Airlines; Attractions/Cruise; Transportation; Honeymooning/Overseas Wedding; Hotel/Accommodation Providers; Tourism Authority/Association; Online Travel Technology; Special Themes Holidays; Tour Operators/Travel Agents; Travel Media/Publication, etc",https://www.jetro.go.jp/en/database/j-messe/tradefair/detail/110043
22,NICE 2021 New International Catering Expo China,"September 23, 2021 - September 25, 2021",Shenzhen China Asia,"Equipment for catering kitchens, Wine, Liquor, Food, Food ingredients, Seasoning, Food packaging materials, Low-temperature distribution related, Tableware, Smart catering technology, IT related",https://www.jetro.go.jp/en/database/j-messe/tradefair/detail/119550
23,PACKCON China Packaging Container EXPO 2021,"July 14, 2021 - July 16, 2021",Shanghai China Asia,"Paper Packaging Containers, Plastic Packaging Containers, Metal Packaging Containers, Glass Packaging Containers, Packaging Materials, Packaging Accessories, Packaging Services and other type of packaging materials.",https://www.jetro.go.jp/en/database/j-messe/tradefair/detail/110502
24,SinoFoldingCarton 2021,"July 14, 2021 - July 17, 2021",Shanghai China Asia,"Prepress equipment (plate-making machines, digital presses for sample production, digital cutting machines), printing equipment (screen presses, sheet-fed offset presses, flexo presses, digital printing presses, gravure presses, variable information printing systems), folding carton post-processing equipment (box-making machines, die-cutting machines, hot Stamping machine, laminating machine, varnishing machine, window gluing machine, folding and scuffing machine, coating machine, packing machine, embossing machine, cutting machine, roll paper cutting machine, laser processing machine, shrink-wrapping machine, bending machine, die-cutting machine), blith box processing equipment (fully automatic hat box production line, fully automatic/semi-automatic cover machine, blith box processing equipment), parts, inspection equipment, in-house logistics and transportation management systems",https://www.jetro.go.jp/en/database/j-messe/tradefair/detail/110488
25,Sino Corrugated 2021,"July 14, 2021 - July 17, 2021",Shanghai China Asia,"Converting and Ancillary Equipment, Corrugating and Ancillary Equipment, Paper Honeycomb, Corrugated Base Paper, Consumable, Software, Carton Factory Infrastructure and Services, Corrugated Testing Machines.",https://www.jetro.go.jp/en/database/j-messe/tradefair/detail/110486
26,Hainan Expo China International Consumer Products Expo,"May  7, 2021 - May 10, 2021",Haikou (Hainan Province) China Asia,"Fashion Life, Jewelry, Lifestyle & Outdoors, Food & Supplements, logistics, finance, legal consulting, commercial retail, commercial real estate, cross-border e-commerce, testing services, premium consumer products, Chinese time-honored brands, tourism scenery",https://www.jetro.go.jp/en/database/j-messe/tradefair/detail/119536
27,"electronica China 2021 International Trade Fair for Electronic Components, Systems and Applications","April 14, 2021 - April 16, 2021",Shanghai China Asia,"Electronics, Microelectronics, Opto-Electronics, IC Technology, Electronic Parts, Microwave Technology, Sensor System, Switches, Relays, Connecting Devices, Measuring Systems, Testing Devices, Other Electronic Components and Assemblies, Systems, Peripherals.",https://www.jetro.go.jp/en/database/j-messe/tradefair/detail/119488
28,CIOE 2021 China International Optoelectronic Exposition,"September  1, 2021 - September  3, 2021",Shenzhen China Asia,"Optical Communications, Information Processing & Storage, Precision, Advanced Manufacturing, Consumer Electronics, Sensing & Measurement, Energy, Semiconductor Processing, Medical, Lighting & Display, Defense & Security.",https://www.jetro.go.jp/en/database/j-messe/tradefair/detail/119523
29,China International Industry Fair Energy Saving Industrial Accessory Show,"September 14, 2021 - September 18, 2021",Shanghai China Asia,"Energy-saving technology section: hydrogen&solar&energy, gas compressors, fans, ventilation equipment, pumps and vacuum equipment, motors, boilers, energy efficient industrial control devices and technologies, Core basic components and supporting section: Hydraulic power machinery and components, pneumatic power machinery and components, rolling bearings, gear and gear reducer, gearboxes, micro motors and components, transformers, rectifiers and inductors, fasteners, sealing materials, hoses, Industrial cleaning & dustproof and explosion-proof section, dust collector, purification equipment, volatile organic control equipment, noise and vibration control equipment, gas liquid separation and pure equipment, solid waste treatment equipment, sweeping machine, explosion protection system and fire-fighting equipment, environmental testing instruments, health protection products, Labor safety protective products and accessory,Industrial park,etc.",https://www.jetro.go.jp/en/database/j-messe/tradefair/detail/119525
30,ICIF China 2021 China International Chemical Industry Fair,"September 15, 2021 - September 17, 2021",Shanghai China Asia,"Petrochemicals and Energy Chemical Industry,  Basic Chemicals, New Chemical Materials,  Fine and Special Chemicals, Chemical Processing and Technologies, Chemical Packagging, Sotrage and Transportiation, SmartChem and Intelligent Manufacturing,  Chemical Industry Park and Scientific Reserch Institute",https://www.jetro.go.jp/en/database/j-messe/tradefair/detail/119530
31,INTERFILIERE SHANGHAI,"August 26, 2021 - August 27, 2021",Shanghai China Asia,"Lace, Fabrics, OEM/ODM, Embroidery, Accessories, Textile Designers, Fiber & Machinery",https://www.jetro.go.jp/en/database/j-messe/tradefair/detail/119532
32,CILF 2021 China (Shenzhen) International Logistics and Supply Chain Fair,"September 23, 2021 - September 25, 2021",Shenzhen China Asia,"logistics, transport and relevant industries",https://www.jetro.go.jp/en/database/j-messe/tradefair/detail/119519
33,CIE 2021 the 7th China (Shenzhen) International Cross border eCommerce Products Fair,"September 23, 2021 - September 25, 2021",Shenzhen China Asia,"Internet Technology and Application: AI, Cloud & Big Data, IoT, 3D Printing, E-commerce Service Providers: Payment, Training, Consulting, Tax, VAT, Packaging etc., Manufacturers & brand owners from Baby & pregnant care/Cosmetic & beauty/Healthy food/ Wine/Pet supplies/ Consumer Electronics etc.",https://www.jetro.go.jp/en/database/j-messe/tradefair/detail/119517
34,SZGH2021 The 29th China (Shenzhen) International Gifts and Home Products Fair,"October 21, 2021 - October 24, 2021",Shenzhen China Asia,"Arts & Crafts; Auto Parts & Accessories; Baby Products; Beauty; Cases, Bags & Leather Products; Ceramics; Collectibles; Creative & Cultural Products; Electrical Appliances; Fitness & Well-being; Food Items; Glassware; Home Decoration; Home Textile; Household Products; Mobile Electronics Products; Outdoor & Sporting Items; Packaging Products; Promotional Items; Stationery; Watches, Jewelry & Fashion Accessories",https://www.jetro.go.jp/en/database/j-messe/tradefair/detail/119500
35,"SZGH2021 The 29th China (Shenzhen) International Gifts, Handicrafts, Watches Houseware Fair","April 25, 2021 - April 28, 2021",Shenzhen China Asia,"Arts & Crafts; Auto Parts & Accessories; Baby Products; Beauty; Cases, Bags & Leather Products; Ceramics; Collectibles; Creative & Cultural Products; Electrical Appliances; Fitness & Well-being; Food Items; Glassware; Home Decoration; Home Textile; Household Products; Mobile Electronics Products; Outdoor & Sporting Items; Packaging Products; Promotional Items; Stationery; Watches, Jewelry & Fashion Accessories",https://www.jetro.go.jp/en/database/j-messe/tradefair/detail/119499
36,WireShow 2021 China International Wire Cable Industry Exhibition,"August 31, 2021 - September  2, 2021",Shanghai China Asia,"Wire manufacturing & finishing machinery, Cable and stranding machines, Process technology materials, Auxiliary process technology materials, Materials, special wires & cables, Measuring & control technology.",https://www.jetro.go.jp/en/database/j-messe/tradefair/detail/119459
37,Intertextile Shanghai Home Textiles Autumn edition 2021,"August 25, 2021 - August 27, 2021",Shanghai China Asia,"Bed (Blanket, Mattress, Bedding fabrics & accessories), Loungewear & bath (Towels, bath sheets, Bathroom curtains, Bath robes, Loungewear), Curtains & Curtain Fabrics, Sun Protection (blinds ), Upholstery & Sofa Fabrics, Sofa/ Chair covers, Cushions, Wallcoverings, Wall decorations, Wallpaper, Furniture leather, Rugs & carpets, tapestries, Table & Kitchen linen, Kitchen wear, oven gloves, Handkerchief, Tissue box cover, table cloth, foils, Interior (non-textile), Sewing thread, Embroidery thread, etc.",https://www.jetro.go.jp/en/database/j-messe/tradefair/detail/119426
38,CAWFF 2021 22nd China (Anhui) International Wine Food Fair,"May  7, 2021 - May  9, 2021",Hefei China Asia,"wine, spirits, food, beverage, condiment, packaging and machinery, E-commerce, etc.",https://www.jetro.go.jp/en/database/j-messe/tradefair/detail/119347
39,Hong Kong Electronics Fair (Spring Edition),"April 13, 2022 - April 16, 2022",Hong Kong China Asia,"Electronics related Products; Audio Visual Products, Bags & Cases, Critical Components, Digital Imaging, Eco-Friendly Products, Electronic Accessories, Electronic Gaming, Electronic Manufacturing Services (EMS), Electronic Parts, Components and Production Technology, 3D Printing, AIoT & Voice Recognition, XR, Automotive & In-Vehicle Electronics, Business of IP, etc.",https://www.jetro.go.jp/en/database/j-messe/tradefair/detail/119354
40,FLOWTECH CHINA 2021,"June  2, 2021 - June  4, 2021",Shanghai China Asia,"Centrifugal Pump, Sewage Lift Pump, Chemical Pump, Metering Pump, Diaphragm Pump, Screw Pump, Piston Pump, Reciprocating Pump, Rotor Pump, Jet Pump, Other Pumps, Ball Value, Butterfly Value, Gate Value, Globe Value, Check Value, Trap Value, Solenoid Valve, Regulating Value, Throttle Value, Copper Value, Safely Value, Intelligent Water Supply, Complete Equipment, Frequency Converter, Steady Flow Tank, Control Cabinet, Vertical Centrifugal Pump, Control Water Tank, Computer Software, CNC Machine Tool, Soft Sealings, Flange, Value Positioner, Casting Parts / Forging Parts, Other Value Accessories, Electric Actuator, Pneumatic Actuator, Manual Actuator, Hydraulic Actuator, Pneumatic Components, Other Valves / Actuators, Composite Pipe, Elbow Pipe, Corrugated Pipe, Tee Pipe and Four-Way Pipe, Elbow, Hose, Other Pipes / Connectors, Motor, Hard Sealing, Pump Housing, Bearing / Coupler, Pump and Value Testing Equipment, Other Pump and Pipe Accessories",https://www.jetro.go.jp/en/database/j-messe/tradefair/detail/119365
41,CIFF2021 2nd Phase 47th China International Furniture Fair (Guangzhou) 2nd Phase,"March 28, 2021 - March 31, 2021",Guangzhou China Asia,"Office furniture, Hotel furniture,  Commercial furniture, public furniture, Furniture machinery, Raw materials & components",https://www.jetro.go.jp/en/database/j-messe/tradefair/detail/119352
42,CTEF 2021 13th China (Shanghai) International Chemical Technology Equipment Fair,"August 25, 2021 - August 27, 2021",Shanghai China Asia,"Complete chemical plant and equipment, Separation, filtration, distillation, extraction, purification, crystallization equipment, Drying, crushing, mixing equipment, Mass transfer equipment, Heat transfer, heat exchange, refrigeration and other heat treatment equipment, Industrial cleaning & anti-corrosion equipment technology, Equipment repair, maintenance and management, Storage & transportation, packaging technology and pressure vessels, Pumps, valves, pipelines and other fluid machinery equipment, Sealing equipment & accessories, Instrumentation &  industrial automation equipment, Process control system and software, Industrial wastewater treatment equipment, Industrial waste gas treatment equipment, Solid waste treatment equipment",https://www.jetro.go.jp/en/database/j-messe/tradefair/detail/119360
43,HDE 2021 Shanghai International Hospitality Design Supplies Expo,"March 30, 2021 - April  2, 2021",Shanghai China Asia,"Decorative Engineering, Engineering Design, Fitness & Leisure, Outdoor Recreation, Interior Design, Lighting & Intelligent Control System, Smart Hotel, Hotel Textiles & Uniforms, Hotel Room Appliances, Hotel Room Amenities",https://www.jetro.go.jp/en/database/j-messe/tradefair/detail/119366
44,electronicAsia 2021,"October 13, 2021 - October 16, 2021",Hong Kong China Asia,"General Semiconductors, Power Semiconductor Components, Electronics, Microelectronics, Opto-Electronics, IC Technology, Electronic Parts, Microwave Technology, Sensor System, Switches, Relays, Connecting Devices, Measuring Systems, Testing Devices, Other Electronic Components and Assemblies,Systems.",https://www.jetro.go.jp/en/database/j-messe/tradefair/detail/119490
45,ACLE All China Leather Exhibition 2021,"August 31, 2021 - September  2, 2021",Shanghai China Asia,"Hide and Skin, Semi-Finished/Crust/Finished Leather, Synthetic, Leather Chemicals/Dye, Shoe Components, Leather Tanning/Finishing Machinery, Technology/Services/Association/Trade Press, Woven & Natural Materials, Leathercraft Machines/Tools/Supplies/Hardware/Fittings/Accessories.",https://www.jetro.go.jp/en/database/j-messe/tradefair/detail/119456
46,Hong Kong International Tea Fair 2021,"August 12, 2021 - August 14, 2021",Hong Kong China Asia,"Beverages, Coffee, Tea & Cocoa, Vegetables & Fruits, Baked Products, Seasonings & Condiments, Confectionary & Snacks, Packaging Materials,  Home Textiles, Home Decorations & Crafts , Household Products , Bar Accessories , Drinkware, Home Storage & Organization,  Sundry Household Items, Kitchenware, Tableware, Association Services & Government  Organisations, Printing Services",https://www.jetro.go.jp/en/database/j-messe/tradefair/detail/119367
47,IE expo China 2021,"April 20, 2021 - April 22, 2021",Shanghai China Asia,"Water and Sewage Treatment, Water Supply and Sewerage Systems, Mechanical Engineering and Plant Engineering in Water Management, Hydraulic Engineering, Refuse Management and Recycling, Waste to Energy Resources, Street Cleaning and Maintenance, Old Site and Soil Remediation, Noise and Vibration Control, Air Pollution Control, Flue Gas Scrubbing and Fresh Air, Environmental Monitoring and Measuring, Environmental Services, Education, Research and Technology transfer",https://www.jetro.go.jp/en/database/j-messe/tradefair/detail/119368
48,PCE2021 Shanghai International Personal Care Expo,"August  5, 2021 - August  7, 2021",Shanghai China Asia,"Sanitary care products: toilet paper, facial tissue, kitchen paper, diapers, wipes, sanitary napkins, soft cotton towels, Maternal and child care supplies: lotion, shampoo, shower gel, buttock protection cream, talcum powder, moisture cream, olive oil, pregnancy skin care products, radiation protective clothing, Sterilizing protective supplies : disinfectant, mildew remover, sterilization lamp, forehead temperature gun, mask, antibacterial articles, Beauty, healthy, personal care appliances : beauty apparatus, hair dryer, razor, hair clipper, straight/curly hair apparatus, eye care apparatus, massage apparatus, health balance, humidifier, Health supplies : health pillow, fascia gun, smart toilet lid, foot tub, pedicure machine, body underwear, private care products, Cleaning supplies : shampoo, body wash, hand sanitizer, laundry detergent, soap, detergent, oral care products, OEM/ODM, personal care products franchise and other related products",https://www.jetro.go.jp/en/database/j-messe/tradefair/detail/119372
