,EventName,Date,City/Country,Exhibits,URL
144,AMTS 2021,"July  7, 2021 - July 10, 2021",Shanghai China Asia,"Automotive design and development, automotive materials, manufacturing equipment and technology, automotive parts manufacturing equipment and production lines, cell production equipment and technology, automotive interior manufacturing equipment, processes and technologies, car body manufacturing processes and equipment and technology, chassis manufacturing equipment and technology, automotive manufacturing and maintenance Related robots, parts, equipment and technology, assembly equipment and technology, handling equipment and technology, automotive maintenance equipment and technology, quality control and testing equipment and devices, new energy vehicle equipment and engineering, electricity Development technology and equipment for electric vehicles (EV), commercial vehicle manufacturing equipment and technology, lightweight manufacturing equipment and technology, automotive engineering and services",https://www.jetro.go.jp/en/database/j-messe/tradefair/detail/110028
145,AHTE 2021,"July  7, 2021 - July 10, 2021",Shanghai China Asia,"Assembly Systems, Handling Technology, Assembly Technology, Drives-Control-Testing, Intelligent Logistics in Production Line, Software and Services",https://www.jetro.go.jp/en/database/j-messe/tradefair/detail/110029
146,CIBRUSH 2021 Shanghai International Brush Industry Exhibition,"December  5, 2021 - December  7, 2021",Shanghai China Asia,"Raw materials and Fittings,Machinery and Equipment,Accessories,Daily Brush,Industry Brush,etc.",https://www.jetro.go.jp/en/database/j-messe/tradefair/detail/104787
147,AIREXPO CHINA 2021 8th Shanghai International Aerospace Technology and Equipment Exhibition 2020,"June 16, 2021 - June 18, 2021",Shanghai China Asia,"Aircraft, Aerospace engine design and manufacturing, aerospace electronics & airborne equipment, aerospace information technology & intelligence, new technologies and new materials in aerospace, Airport facilities and technology equipment, Special vehicles, Civil Military integration",https://www.jetro.go.jp/en/database/j-messe/tradefair/detail/109547
148,ITMA ASIA CITME 2020,"June 12, 2021 - June 16, 2021",Shanghai China Asia,textile machinery,https://www.jetro.go.jp/en/database/j-messe/tradefair/detail/109085
149,China International Tire Expo 2021,"August 16, 2021 - August 18, 2021",Shanghai China Asia,"Tires, Casings, Tubes, Wheels / Rims, Tire Accessories, Equipment for Tire Repairs, Materials, Plants, Equipment, Tools for Tire & Wheel Production, Tire Retreading, Other related services and products",https://www.jetro.go.jp/en/database/j-messe/tradefair/detail/108405
150,CHINAPLAS 2021 34th International Exhibition on Plastics and Rubber Industries,"April 13, 2021 - April 16, 2021",Shenzhen China Asia,3D Technology /Die & Mould /Extrusion Machinery /Film Technology /Injection Molding Machinery /Plastic Packaging Machinery /Recycling Technology /Rubber Machinery /Bioplastics /Chemicals & Raw Materials /Colour Pigment & Masterbatch /Semi-Finished Products /Thermoplastic Elastomers & Rubber,https://www.jetro.go.jp/en/database/j-messe/tradefair/detail/106132
