,EventName,Date,City/Country,Exhibits,URL
49,All in CARAVANING 2021,"June 18, 2021 - June 20, 2021",Beijing China Asia,"Caravans / Trailers, Motor caravans, Basic vehicles, Mobile homes, Detachable parts and components for caravans and motor caravans, Installations / Heating / Gas / Water, Energy supply / Electrical installations / Electrical appliances, Antennas / Receivers / Navigation systems, Vehicle parts / Chassis units / Axles / Trailer equipment, Tents, Caravaning / Camping equipment, Outdoor, Caravanning tourist industry / Outdoor activities, Campsite equipment suppliers /Recreational equipment suppliers, Rental Agents, Purchase / Financing / Insurance, Associations and clubs, Media, Other Services",https://www.jetro.go.jp/en/database/j-messe/tradefair/detail/119457
50,Intertextile Shanghai Apparel Fabrics Autumn Edition,"August 25, 2021 - August 27, 2021",Shanghai China Asia,"Cotton, wool, silk, linen, ramie, man-made, knitted, coated fabrics, Lingerie & swimwear fabrics, Functional fabrics, Printed fabrics, Fibers & yarns, Embroidery & lace, Accessories, Textile-related CAD/CAM/CIM technology, Design & styling agencies, Fashion & textile trade publications, etc.",https://www.jetro.go.jp/en/database/j-messe/tradefair/detail/110593
51,33rd China International Optics Fair,"September  8, 2021 - September 10, 2021",Beijing China Asia,"Frames, Lenses & Accessories, Machinery & Materials, Ophthalmology, Others",https://www.jetro.go.jp/en/database/j-messe/tradefair/detail/119414
52,ChinaBio Partnering Forum 2021,"May 10, 2021 - May 14, 2021",Shanghai China Asia,"Pharma and Biotech, Biotech R&D Services, Medtech, Digital Health, AI, Startups, Investment, Venture Capital, etc.",https://www.jetro.go.jp/en/database/j-messe/tradefair/detail/119392
53,18th Music Guangzhou,"May 16, 2021 - May 19, 2021",Guangzhou China Asia,"Piano & Keyboards , Electric & Electronic Musical, Instruments, Bowed and stringed instruments, Music Education & Training, Accordions & Harmonicas, Fretted Guitars, Instruments, Brass wind Instruments, Traditional Chinese Instruments, Sheet Music & Books,  Music Related Computer Hardware & Software",https://www.jetro.go.jp/en/database/j-messe/tradefair/detail/119384
54,26th Dental South China International Expo Conference,"May 10, 2021 - May 13, 2021",Guangzhou China Asia,"Consumer Products for dentists, Instruments or material for maxillofacial surgery, Instruments or material for root canal, Instruments or material for periodontal disease, Instruments or material for Orthodontics, Instruments or material for Implants, Equipment for dental technicians, Consumer Products for dental technicians, Dental Labs, Precious and non precious alloys, Furniture and Lighting, X-ray products/ Equipment, Pharmaceuticals, Disinfection Products, Equipment or software for hospital management, One-off dental consumables, Oral Health Care Products, Other dental products",https://www.jetro.go.jp/en/database/j-messe/tradefair/detail/119385
55,Cosmoprof Asia 2021,"November 16, 2021 - November 19, 2021",Hong Kong China Asia,"Cosmetics & Toiletries, Professional Beauty Salon, Hair Salon, Nail & Accessories, Natural & Organic, Clean & Hygiene",https://www.jetro.go.jp/en/database/j-messe/tradefair/detail/119248
56,Hong Kong Baby Products Fair,"July 26, 2021 - July 29, 2021",Hong Kong China Asia,"Baby Wears, Baby Care & Bath Products , Strollers & Gears , Bedding Items , Nurseries , Mother Care , Baby Safety Items, Baby Shoes , Baby Toys & Activities , Feeding, Baby Furniture, Baby Gift Sets, Baby Shoes, Baby Bath Toys, Baby Books, Baby Educational Toys & DVDs, Baby Inflatable Toys, Baby Mobile Toys , Baby Music , Baby Musical Toys, Baby Play Gyms , Baby Play Mats, Baby Rattles, Baby Soft Toys , Baby Teethers , Baby Walkers",https://www.jetro.go.jp/en/database/j-messe/tradefair/detail/109797
57,Hong Kong Toys Games Fair,"July 26, 2021 - July 29, 2021",Hong Kong China Asia,"candy toys, branded toys, educational toys & games, electronic & remote-control toys, festive & party supplies, outdoor & sporting items, toy packaging, smart-tech toys, soft toys & dolls, video games, services, pet toys, awards, etc.",https://www.jetro.go.jp/en/database/j-messe/tradefair/detail/109798
58,36th Hong Kong Gifts Premium Fair,"July 26, 2021 - July 29, 2021",Hong Kong China Asia,"Advertising Gifts & Premium, Beauty & Health Goods, Corporate Gifts, Cultural Gifts and Crafts, Fashion Accessories, Figurines & Decorations, Fine Porcelain Gifts, Green Gifts, Licensed Gifts, Packaging, Party & Festive Items, Pictures & Photo Frames, Stationery & Paper, Tech Gifts, Testing, Inspection and Certification, Toys & Sporting Goods, Trade Services, Travel & Outdoor Goods, Watches & Clocks",https://www.jetro.go.jp/en/database/j-messe/tradefair/detail/110650
59,Hong Kong International Printing Packaging Fair,"July 26, 2021 - July 29, 2021",Hong Kong China Asia,"Advertising & Signage, Digital Printing & 3D Printing , Food & Beverage Packaging Solutions ,  Green Printing & Packaging Solutions, Innovative Retail Display Solutions, Packaging Services, Printing & Packaging Equipment , Printing & Packaging Solutions for Fashion & Accessories, Printing Consumables & Packaging Materials , Printing Services, etc.",https://www.jetro.go.jp/en/database/j-messe/tradefair/detail/119170
60,36th Hong Kong Houseware Fair,"July 26, 2021 - July 29, 2021",Hong Kong China Asia,"Book & Printed Item,Building Materials & Hardware, Consumer Electronics & Electrical Appliances, Environmental Protection Equipment & Products, Furniture & Furnishing, Garments & Clothing Accessories , Gift & Premiums , Health & Beauty , Household Products , Lighting Products, Packaging Products & Material,Pet & Pet Supplies, Service , Machinery, Raw Materials & Scientific Equipment, Sports Goods, Stationery & Office Equipment, Telecom Products , Watch & Clock ,Electrical Equipment & Electronic Components ,Textiles, Fabrics & Yarns",https://www.jetro.go.jp/en/database/j-messe/tradefair/detail/119168
61,Build4Asia 2022,"May  4, 2022 - May  6, 2022",Hong Kong China Asia,"Electrical Engineering and Lighting, Building Technology, Material and Decoration, Security, Safety and Fire Protection, etc.",https://www.jetro.go.jp/en/database/j-messe/tradefair/detail/119345
62,"Buildtex 2022 14th Asian International Building Technology, Material and Decoration Show","May  4, 2022 - May  6, 2022",Hong Kong China Asia,"Air Filtration Equipment, Air-Conditioning Solutions, Architectural / Interior / Landscape Design & Service, Architectural Lighting, Building & Interior Decorative Material, Building Management Solution, Building Paint & Coating, Ceiling / Flooring / Wall Covering / Fabric / Carpet, Communication Solution, Energy Efficiency Solution, Energy Saving / Insulation / Heat Preservation Material, Facility Management System, Fireproof Material, Furniture & Soft Furnishing, Heating, Ventilation, and Air Conditional (HVAC), Home Automation Solution, Intelligent Building Solution, Lighting Control Solution, Network Management Solution, Pipe & Fitting, Sustainable / Green Building & Construction Material, Water / Environmental Management Technology, Waterproof Material / Roofing & Ceiling",https://www.jetro.go.jp/en/database/j-messe/tradefair/detail/119344
63,"Asian Securitex 2022 16th Asian International Security, Safety and Fire Protection Show Conference","May  4, 2022 - May  6, 2022",Hong Kong China Asia,"Access Control, Biometrics, Car Parking System, Cash Management Solution, CCTV & Remote Monitoring Control Systems, Electronic Article Surveillance (EAS), Electronic Safety, Fire Safety Solutions, Home Automation Security Solution, Information / Data Security, Integrated Security Management Systems, Intelligent Buildings, Intruder Alarm Solution, IP Security, Lock Sales, Meter Detectors & X-ray /Screening Equipment, Rescue & Emergency Equipment, Safety Clothing, Security Doors, Gates & Shutters, Security Guard Services, Security Solutions, Smartcard / Card Technology, Surveillance Solutions, Traffic Counting Solutions, Transportation Security",https://www.jetro.go.jp/en/database/j-messe/tradefair/detail/119342
64,Asian Elenex 2022 19th Asian International Electrical Engineering and Lighting Show,"May  4, 2022 - May  6, 2022",Hong Kong China Asia,"Cables, Cable Glands & Cable Trays, Circuit Breakers, Commercial & Office Lightings, Connectors / Connecting System, Controls & Dimmers, Daylight Technologies, Decorative & Custom Fixtures, Electrical Power Distribution & Transmission, Emergency Lighting & Safety Signs, Fiber Optic Lightings, Fire Safety Products, General Lighting Lamps, Energy Saving Lamps, LED Lighting Solutions, Lightning Protection Systems & Earth Rods, Meter & Monitoring Systems, Motors & Motor Controls, Outdoor & Street Lightings, Power Generation Equipment / Generators, Renewable Energy Technologies, Switches, Testing & Measuring Instruments for Power, Thermal Imaging & Infrared Cameras, Transformers, Wireless Solution, etc.",https://www.jetro.go.jp/en/database/j-messe/tradefair/detail/119341
65,IOTE2021 International Internet of Things Exhibition (15th),"April 21, 2021 - April 23, 2021",Shanghai China Asia,"IoT industry chain, including IoT perceptual layer (RFID, Smart Card, Smart Sensor, Bar Code, Cameras), transport network layer ( Bluetooth, 3G/4G/5G, Zigbee, GPS, GPRS , WIFI, WSN ) and Intelligent applications layer ( Cloud, Mobile Payment, RTLS, Smart Home, and etc)",https://www.jetro.go.jp/en/database/j-messe/tradefair/detail/110238
66,LUXE PACK SHANGHAI 2021,"April  7, 2021 - April  8, 2021",Shanghai China Asia,"Bags, Bottles, Boxes, Containers, Decoration/finishing techniques, Dispensers/pumps/ /valves/sprayers, Jars, Labels, Raw materials (paper, foam,...), Ribbons, Samples, Tubes, Vials, Monodoses, Anti-counter feiting solutions, smart packaging, and more.",https://www.jetro.go.jp/en/database/j-messe/tradefair/detail/109840
67,"CINEB2021 China International Nail Expo, Beijing","November 28, 2021 - November 30, 2021",Beijing China Asia,"Nail art products, Nail packaging & tools, Eyelash extension products, Nail polish and gel products, Natural nail caring products, Nail & Eyelash Training Organizations, Nail & Eyelash Industry Associations, Facilities and furniture for Salons, Others",https://www.jetro.go.jp/en/database/j-messe/tradefair/detail/119334
68,2021 Kid's Expo China Chengdu,"November 19, 2021 - November 21, 2021",Chengdu China Asia,"Learning Tools and Courses - Textbooks, Electronics Items, Multimedia products, interactive app, Online, Cloud services, etc., Interests and Hobbies related -  musical instrument, painting tools, dance, handcraft, sport equipment, etc., Articles for Daily use - stationary, clothing uniform furniture, bedding, etc., Services for children with special Needs - Therapy for special kid, training center, non-profit center, etc., Preschool institutions -  international kindergarten, preschool education groups, patient-child interactive center, in-service training, etc., Kindergarten management, Kindergarten Design and Construction - Kindergarten design, environment construction, eco-friendly floor, grassland, amusement facilities, safety facilities, etc., Publishing - Children's book and magazines, etc., Other products and services -  Kids safety, insurance, health, etc.",https://www.jetro.go.jp/en/database/j-messe/tradefair/detail/119338
69,Asia Pacific Cleanroom Technology Equipment Exhibition 2021,"August 16, 2021 - August 18, 2021",Guangzhou China Asia,"Clean bench, clean booth, FFU, clean air filter, clean luminary, biosafety cabinet, pass box & window, air shower, fan filter unit, cleaner, air self-purification device, sterilization equipment, wash disinfecting equipment, wash sterilization equipment, Dust-proof and static-proof gowning (hats, clothes, pants, shoes, boots, goggles, protective gloves), cleanroom paper, pens, dust-free paper, cleanroom swabs; filter materials; static-proof wrist scraps, ESD table mats, static-proof ESD chairs, Central air conditioning system, auxiliary products, clean air conditioner, blower, automatic control products, Ceiling, keel, wallboard, flooring, coating material & floor, door, window & glass, color plate, clean aluminum products, Measuring instrument, corpuscular counter, sampler, flow hood, differential pressure indicator, electrostatic energy analyzer, supervision system,  Design institute, design & engineering & decoration & detection company, GMP pharmaceutical engineering, etc.",https://www.jetro.go.jp/en/database/j-messe/tradefair/detail/119337
70,CDCE2021 International Data Center Cloud Computing Industry Expo 2021,"November 30, 2021 - December  2, 2021",Shanghai China Asia,"Total Infrastructure solutions, Micro Module Data Center, Power Generator, Supply & Distribution Systems, Air Conditioning, Cooling & Fresh Air System, Fire Fighting System, Security System, Generic Cabling System, LED Display, Engineering and System Integrator, Advanced Construction Materials, Construction Planning, Consultation, Design & Maintenance, Data Center Automated Operation and Maintenance Software, KVM, Monitoring System, Capital Management, Visualized Data Center Management System, Inspection Robot, Information Technology Operation Management, IT System, Telecommunication System, Computer Room / Cabinet Rental, Server Co-location/ Rental, System Integration/ Development, System Maintenance & Monitoring, Cloud Services (PaaS, IaaS, SaaS), Managed Cloud, Migration Services, Public/ Private/ Hybrid Cloud, Hardware, Software & Services",https://www.jetro.go.jp/en/database/j-messe/tradefair/detail/119317
71,"CHINA AID 2021 International Exhibition of Senior care, Rehabilitation Medicine and Healthcare,Shanghai","June  9, 2021 - June 11, 2021",Shanghai China Asia,"Senior Care,Mobility Products & Assistive Technology,RehabilitationTechnology & Services,Nursing Care,Healthcare Management,Elderly-friendly Housing & Living Environment",https://www.jetro.go.jp/en/database/j-messe/tradefair/detail/110659
72,Hong Kong International Wine Spirits Fair 2021,"November 11, 2021 - November 13, 2021",Hong Kong China Asia,"Wine, Spirits, Brandy, Beer, Sparkling Wine, Sake, Champagne, Cocktail, Vodka, Tequila, Soju, Chinese Rice Wine, Yellow Wine, Wine Glasses, Spitting Bowl, Decanter, Wine Cooler, Wine Bottle Opener, Wine Bag, Wine Stopper, Cocktail Shaker, Ice Basket, Wine Rack, Wine Labeling, Packaging, Storage and Shipping, Wine Tourism and Association, Education about Wine, Investment Project, Media, Bakery Confectionery, Dairy Product, Seafood, Nuts, Oils, Vinegar, Pasta, Frozen Product, Processed Food, Light Snacks",https://www.jetro.go.jp/en/database/j-messe/tradefair/detail/119264
73,EP Shanghai 2021 The 31st China International Exhibition on Electric Power Equipment and Technology,"November 30, 2021 - December  2, 2021",Shanghai China Asia,"Power transmission and distribution equipment and technology, smart grid technology, power generation equipment - thermal/hydro/nuclear, alternative sources of energy, construction and engineering of turn-key projects, power dispatching systems, control and testing equipment and instrumentation, building and electrical installation systems (building management and control system, switchgear, lighting system), LV electrical equipment and accessories, power electronics equipment, electric power automation, industrial power equipment (UPS, diesel generators and alternators), energy saving and environmental protection technology, manufacturing equipment, machinery and raw materials for production of power and electrical products",https://www.jetro.go.jp/en/database/j-messe/tradefair/detail/119275
74,International Fastener Show China 2021,"November 14, 2021 - November 16, 2021",Shanghai China Asia,"Hall 1: Machinery, Fastener materials, Moulds and consumption goods, Fastener manufacturing machinery, Auxiliary equipment, Inspection equipment / Measuring devices, Installation / Measurement and maintenance Moulds / Consumption goods Fastener technology / Services, Hall 2: Fasteners Standard fasteners Non- standard fasteners, Aerospace fasteners / Military fastener,  Construction fasteners, Other related fasteners and parts",https://www.jetro.go.jp/en/database/j-messe/tradefair/detail/119250
75,"Hong Kong International Diamond, Gem Pearl Show 2021","July  2, 2021 - July  6, 2021",Hong Kong China Asia,"Diamonds, Pearls, Precious Stones, Semi-Precious Stones, Watch & Clock, etc.",https://www.jetro.go.jp/en/database/j-messe/tradefair/detail/109602
76,CFSE 2021 China Fisheries Seafood Expo,"October 27, 2021 - October 29, 2021",Qingdao China Asia,"Fresh and frozen seafood suppliers, Seafood processors specializing in raw material, value-added and pre-packaged seafood products, Packaging and processing equipment, Freight-forwarders and logistical services, Aquaculture equipment and feed, Government agencies, Trade associations, Industry service providers",https://www.jetro.go.jp/en/database/j-messe/tradefair/detail/109779
77,CXIVFF China Xiamen International Vegetarian Food And Organic Products Fair,"May  6, 2021 - May 10, 2021",Xiamen China Asia,"Vegetarian Materials, Vegetarian Food, Organic Food, Natural Food, Healthy Food, Vegetarian Snacks, Fruits, Coffee, tea, Vegetarian Books, Vegetarian Restaurants, and other Vegetarian Products.",https://www.jetro.go.jp/en/database/j-messe/tradefair/detail/119241
78,Art Basel in Hong Kong,"May 21, 2021 - May 23, 2021",Hong Kong China Asia,"Modern & Contemporary Art, Photographs/Video, etc.",https://www.jetro.go.jp/en/database/j-messe/tradefair/detail/110233
79,CIIF2021 China International Industry Fair,"September 14, 2021 - September 18, 2021",Shanghai China Asia,"There are 9 theme shows such as MWCS(metalworking&CNC machining tool show),IAS(industrial automation show),EIAS(Energy-saving & Industrial Accessory Show),ICTS(Information and Communication Technology Show),ES(Energy Show),NEAS(New Energy Auto Show), RS(Robotic Show) and etcs.",https://www.jetro.go.jp/en/database/j-messe/tradefair/detail/119092
80,Tube China 2022 All China International Tube and Pipe Industry Trade Fair,"September 26, 2022 - September 29, 2022",Shanghai China Asia,"raw materials, tubes and accessories, tube manufacturing machinery, rebuilt and reconditioned machinery, process technology tools and auxiliaries, measuring and control technology, testing, trading, stockists of tube all kinds, pipeline and OCTG technology, profiles and machinery, etc.",https://www.jetro.go.jp/en/database/j-messe/tradefair/detail/110358
81,"Motor Magnetic Expo 2021 19th Shenzhen (China) International Small Motor, Electric Machinery Magnetic Materials Exhibition","July  1, 2021 - July  3, 2021",Shenzhen China Asia,"All Kinds of Electric Motors, Manufacturing and Testing Equipment, Accessories and Components, All Kinds of Magnetic Materials, All Kinds of Magnetic Products and Manufacturing and Testing Equipment, and more.",https://www.jetro.go.jp/en/database/j-messe/tradefair/detail/119186
82,LuxeHome 10th Shanghai International Luxury Living and Interior Furnishing Exhibition,"July 22, 2021 - July 24, 2021",Shanghai China Asia,"Home Textiles And Bedding Supplies, Tableware Art, Stylish Home Decor Items & Articles, Stylish Furniture, Crafts, Decorative Painting & Accessories, Glassware & Crystal, Ceramics, Home Furnishing Store & Storage, Lights & Lighting, Kitchenware, Premium, Gift, Promotional Items, Customize Items, Hotel Supplies, Home Creative Art Pieces, Independent Designer Works, Cases, Bags & Leather Products, Smart Home Furnishing Products, Elecronic & Electrical Appliances, Collectables, Toy, Stationery, Sports & Leisure Products, Jewelry & Fashion Accessories, Health & Beauty Products, Sanitary Facilities, Wallpaper & Decorative Materials, Floral Art, Iron Art & Horticulture, Green & Environmental-Friendly Materials",https://www.jetro.go.jp/en/database/j-messe/tradefair/detail/119185
83,"IWF SHANGHAI 2021 The 8th China (Shanghai) Int'l Health, Wellness, Fitness Expo","April  6, 2021 - April  8, 2021",Shanghai China Asia,"Fitness Equipment, Club Supplies & Related, Swimming Pool Equipment, Facility & Appliance,Nutrition & Health Food, Fashion Apparel, Shoes & ACC, Indoor Functional Equipment, Provinces and Cites Sports Bureau, Local Sports Industry Association, Sports Tourism Service",https://www.jetro.go.jp/en/database/j-messe/tradefair/detail/119174
84,IPB 2021 19th International Powder Bulk Solids Processing Conference Exhibition,"July 28, 2021 - July 30, 2021",Shanghai China Asia,"Basic processing technologies for powder and bulk material, Plant engineering and processing components, Measurement, Control, Automation, Particle technologies, Particle analysis and Characterization, Safety and environmental technologies, Services",https://www.jetro.go.jp/en/database/j-messe/tradefair/detail/119171
85,CHINA DIECASTING 2021,"July  7, 2021 - July  9, 2021",Shanghai China Asia,"Peripheral equipment, After processing and surface treatment, Die casting machine parts, Accessories supplies, Furnace, Low pressure die casting, Die casting machine, Die casting, Die casting die, Raw/Auxiliary materials, Mechanical processing equipment, Die casting software, Industry service, Detection & Environmental protection instrument and equipment, Detection & Environmental protection instrument and equipment, Casting machines and plants, Peripheral devices and systems, Components ready for installation, Wear parts, Base metals and alloys, Metal melting furnace and related devices, Nonferrous metal casting dies, Mould material and its after treatment, Die accessories, Machine tools, After treatment of die, Special process and device, Auxiliary materials, Casting detection device and instrument, Software for special casting, After treatment of castings, Trimming devices and tools, Cleaner production and waste disposal, Safe operation and environmental protection",https://www.jetro.go.jp/en/database/j-messe/tradefair/detail/119169
86,2021 ICEE ICEF Guangzhou International Cross border E commerce Goods Expo,"July 21, 2021 - July 23, 2021",Guangzhou China Asia,"Import E-commerce business, Export E-commerce business, Payment platform, Logistics service platform, Integrated service, Cross-border Business, and more.",https://www.jetro.go.jp/en/database/j-messe/tradefair/detail/119167
87,HKTDC Hong Kong International Jewellery Show 2021,"July  2, 2021 - July  6, 2021",Hong Kong China Asia,"Fine Jewellery, Silver Jewellery, Antique Jewellery, Jewellery Tools & Equipment, Trade Publications & Services, Brand Name Watches & Clocks, Finished Jewellery, Jewellery Accessories, Jade Jewellery, Jewellery Display & Packaging Material, Trade Associations",https://www.jetro.go.jp/en/database/j-messe/tradefair/detail/109676
88,China Daily Use Articles Trade Fair 2021,"July 22, 2021 - July 24, 2021",Shanghai China Asia,"Daily use articles including kitchenware, cleaning and bath products, household products, household textiles, smart home appliances, fashion products and gifts",https://www.jetro.go.jp/en/database/j-messe/tradefair/detail/110492
89,Natural Health Nutrition Expo Spring 2021,"May 12, 2021 - May 14, 2021",Shanghai China Asia,"Health food, Imported dietary supplements and imported healthy foods, Functional beverages, Special Medical Formula Food, Nutritional tonics, Beauty products, Probiotics products, Technology and Services (Registration/Transfer/OEM): OEM Contract Customization, Media, Associations, Management Consulting Services",https://www.jetro.go.jp/en/database/j-messe/tradefair/detail/108964
90,Inter Lubric China 21st China International Lubricants and Technology Exhibition,"June  9, 2021 - June 11, 2021",Shanghai China Asia,"Automotive, lubricant products and automotive chemical maintenance products, Industrial lubricating oil and grease, Metal working lubricants and fluids, anti-rust materials, Lubricant additives and base oil,Packing, charging and mixing equipment for lubricating production, Testing, quality control, recycling, assessment technology and equipment for lubricant product,  Others(Lubricating human resource, consultancy, media, etc)",https://www.jetro.go.jp/en/database/j-messe/tradefair/detail/119095
91,CWEE 2021 Shanghai Wind Energy Exhibition,"June 17, 2021 - June 19, 2021",Shanghai China Asia,"Wind Turbines, Accessories & Equipment, Offshore Wind Energy Equipment and Technology, Wind Farm Management, Wind Turbine O&M Equipment, O&M Auxiliary Equipment, Spare Part, Repair Kit",https://www.jetro.go.jp/en/database/j-messe/tradefair/detail/119094
92,BEW 2021 25th Beijing Essen Welding Cutting Fair,"June 16, 2021 - June 19, 2021",Shanghai China Asia,"Equipment, machines and systems for welding, thermal cutting, soldering, brazing, thermal spraying, adhesive bonding, destructive & non-destructive testing, etc Materials, installations, CNC Systems, CAD/CAM systems, process control systems and monitoring installations, occupational health & safety.",https://www.jetro.go.jp/en/database/j-messe/tradefair/detail/119093
93,22nd China (Guangzhou) International Laser Equipment and Sheet Metal Industry Exhibition,"September 16, 2021 - September 18, 2021",Guangzhou China Asia,"Various sheet metal parts, forging, punching, end cover manufacturers;Plate shearing machine;Various kind of Pressing machine;Forging press machine.",https://www.jetro.go.jp/en/database/j-messe/tradefair/detail/119090
